2000057,2,3,1,5020300,4,3,2057,総見院の胡蝶佗助,そうけんいんのこちょうわびすけ,,,"豊臣秀吉が本能寺の変に倒れた織田信長の追善菩提のために建立した、大徳寺総見院。\n\n本堂には秀吉が奉納した木造織田信長公坐像（重要文化財）は高さ三尺八寸（約115cm）の等身大で、慶派の仏師、康清によって作られました。\n\n2体彫られたうちの1体は、葬儀の際に荼毘にふされますが、香木によって作られたその木像の薫りは洛中一帯に広がったと言われます。\n\n境内には信長公一族の墓、豊臣秀吉が千利休から譲り受けて植えられた胡蝶侘助椿（こちょうわびすけつばき）がある。\n\n毎年、春と秋に一般公開される。※通常非公開\n\n\n\n交通案内／市バス「大徳寺前」下車　徒歩7分",,,,,京都市北区紫野大徳寺町59,075-492-2630,075-492-2630,不可,1000,,1600,30,通常非公開,"H28年　春季特別公開　4月12日～5月22日（この期間は拝観料／大人500円）\n\n秋季特別公開　10月上旬～11月下旬\n\n",大人600円・高校生400円・中学生300円・小学生以下無料（保護者同伴）,,sight/photo/mimon02A/A035.bmp
2000058,2,3,1,5020300,,3,2058,疏水岸の桜,そすいきしのさくら,,,京都市疏水公園にあるバラ科のヤマザクラ。疏水道の四宮～安朱の間の疏水公園内の広場に生立する。,,,,,山科四宮桝山町,,,,,,,,,,,,
2000062,2,3,1,5020300,,3,1000158,大徳寺の柏槙,だいとくじのびゃくしん,,,"大徳寺仏殿南庭にあるビャクシン科のビャクシン（一名イブキ）。境内の仏殿南庭の平地広い空間にある。市指定天然記念物\n\n\n\n●交通案内：市バス大徳寺前下車　徒歩５分\n\n●駐車場情報：バス20台分　2000円\n\n　　　　　　・自家用車40台分　最初2時間500円以後30分毎100円　　　　　　　　　　　　　　　PM8:00～AM8:00　一時間毎100円\n\n＊拝観は終日可能",,,,,京都市北区紫野大徳寺町,075-491-0019,075-491-0016,可能,,,,,無,,無料,不要,sight/photo/mimon02A/A032.bmp
2000063,2,3,1,5020300,8,3,2063,対龍山荘のはぜのき,たいりゅうさんそうのはぜのき,,,市田対龍山荘内茶室露路裏にあるウルシ科のハゼノキ。一帯は苔庭の台地で、北側に小川の流れがあり、流れに沿う吹寄せの低い生垣が根系の北面をしきっている。株元にはとび石がならぶ。明治の庭師、小川治兵衛氏の設計施工にかかるもので、当時の植栽になるものである。,,,,,南禅寺福池町,,,,,,,,,,,,
2000066,2,3,1,5020300,,3,1000251,糺の森の椎,ただすのもりのしい,,,下鴨神社境内、表参道の中程にあるブナ科のツブラシイ。東に泉川あり、表参道に面した平地に生育し、ツバキ、アラカシなどとともに自然型の常緑樹として残存するもの。,,,,3,下鴨宮崎町,,,可,,,,,,,不要,不要,sight/photo/mimon02A/A010.bmp
2000067,2,3,1,5020300,,3,1000251,糺の森の椋,ただすのもりのむく,,,下鴨神社境内の全域に分布するあるニレ科のムクノキ。,,,,,下鴨宮崎町,,,可,,,,,,,不要,不要,sight/photo/mimon02A/A009.bmp
2000068,2,3,1,5020300,,3,1000166,知恩院参道のむくろじ,ちおんいんさんどうのむくろじ,,,知恩院参道、旧桜の馬場北側にあるムクロジ科のムクロジ。ムクロジは果皮が洗濯に、また種子が念珠に用いられるなど、利用価値が高かったことから知恩院の境内が整った江戸時代元禄期に植樹されたと伝えられています。ムクロジは暖帯性で京都市は分布の北限に近いため、これほどの大木（樹高20m）になることは希で貴重。市指定天然記念物。,,,,,東山区林下町400,,,,,,,,,,,,
2000069,2,3,1,5020300,,3,1000253,道風神社の榊,とうふうじんじゃのさかき,,,"道風神社境内にあるツバキ科のサカキ。町はずれの山麓、渓畔にある神社境内の平地にある。道風神社は小野道風を祭神とする郷社。\n\n\n\n○交通案内　ＪＲバス「杉阪口」下車　徒歩約30分\n\n　　　　　　車では千本北大路鷹ケ峰を北に約15分、Ｒ162杉阪口　　　　　　より７分\n\n\n\n○駐車場　自家用車10台　無料",,,,1,京都市北区杉阪道風町１,,,不可,,,,30,なし,特に11月3日夜7:30からのお火焚まつりが見物である。,無料,,
2000070,2,3,1,5020300,7,3,2070,東北院のさざんか,とうほくいんのさざんか,,,東北院の境内にあるツバキ科のサザンカ。あたりはシイ、アラカシの常緑樹でおおわれている。,,,,,浄土寺真如町,,,,,,,,,,,,sight/photo/mimon02A/A022.bmp
2000071,2,3,1,5020300,7,3,2071,東北院の軒端の梅,とうほくいんののきばのうめ,,,東北院境内、本堂の東側にあるバラ科のウメ。「軒端の梅」は、平安時代の女流歌人和泉式部遺愛の梅。ここの梅は謡曲「東北」（とうぼく）に採り上げられて有名になった。,,,,,浄土寺真如町,,,,,,,,,,,,sight/photo/mimon02A/A023.bmp
2000073,2,3,1,5020300,,3,1000186,南禅寺の白檀,なんぜんじのびゃくだん,,,南禅寺三門より東方北側にあるマツ科のビャクシン（一名、イブキ、ビャクダン）。北側は昔からのもので、南側は植え替えられたもの。都名所図絵、秋里籬島著（安永９年～1780）に唐木の白檀二株、山門の内にあり……と記されている。,,,,,南禅寺福地町,,,,,,,,,,,,
2000074,2,3,1,5020300,,3,1000114,本願寺の大銀杏,ほんがんじのおおいちょう,,,"西本願寺境内にあるイチョウ（雄木）。境内の平地で、約30cmの盛土の外周は石の玉垣で囲われている。地上1.5m～3m付近から各方向へ太い水平枝ないしは斜上枝を出す形状はイチョウとしては特異で、逆さ銀杏とも呼ばれる。天明8年（1788）火災の時、御影堂へ水を吹きかけ類焼を防いだといわれ、「水吹きイチョウ」「火伏せのイチョウ」とも呼ばれる。市指定天然記念物。\n\n\n\n",,,,,堀川花屋町下る,,,可,,,,,無休,,,,
2000075,2,3,1,5020300,,3,1000194,平岡八幡宮の椎,ひらおかはちまんぐうのしい,平岡八幡宮の椿,ひらおかはちまんぐうのつばき,"平岡八幡宮本殿前にあるブナ科のツブラシイ。京都市では最大径級のシイである。（樹齢約600年以上）\n\n\n\n椿を愛でる会　境内の樹齢300年の平岡八幡ヤブ椿\n\n　　　　　　　白玉椿伝説の200年の白椿一水をはじめ\n\n　　　　　　　椿の小道の椿が見頃となります。\n\n　　　　　　　境内200種300本。",,,,,梅ケ畑宮ノ口町,,,不可,1000,,1600,,,椿を愛でる会　3月11日～4月15日,無料,,sight/photo/mimon02A/A067.bmp
2000090,2,3,1,5020300,24,3,2090,白山神社のツクバネガシ,はくさんじんじゃのつくばねがし,,,白山神社の社殿裏にある小高い古墳様の丘にツクバネガシがそびえています。幹周7．9m、根元から2本に分かれて伸びた樹高は18mにもおよぶ巨木です。根元の空洞には白山神社の使いであるヘビが住んでいたと伝えられています。「京都の自然200選」のひとつに選ばれています。,,,,,,,,,,,,,,,,,sight/photo/mimon02s/s003.bmp
2000076,2,3,1,5020300,,3,1000195,平野神社の草花と樹木,ひらのじんじゃのくさばなとじゅもく,平野神社紫式部,ひらのじんじゃむらさきしきぶ,"紫式部　平成6年に桜苑内に1,500株　見頃　10月1日～30日迄\n\n無料公開\n\n　10月初旬に紫式部祭を行う。午前10時祭典、速水流献茶、舞楽。\n\n\n\n平野神社は桜の名所であると共に、ここの格式と由緒にちなむ花弁・木花を楽しむことができる。\n\n（春)桜・柴桜・小手毬椿・紫菜種・黄菜種･牡丹・山菫・百合・鉄　　線･一初・山吹・楓\n\n（夏)泰山木・芙蓉・つつじ・さつき・夾竹、桃、君子楠、蛍袋、　　朝顔、紫陽花、水芙蓉\n\n（秋)金木犀、桔梗、不如帰、秋桜、彼岸花(赤・白)、撫子、松楽　　菊、サザンカ\n\n（冬)水仙、梅、浜菊、山茶花、蝋梅、南天、椿\n\n\n\n　　尚、本殿裏山には野鳥が多く飛来し鳴き声が多くきこえる。夏　　期はズクの声もきこえる。",,,,,平野宮本町,,,境内は可。要介添人,600,,1700,,無休,,無料,予約不要,sight/photo/mimon02A/A059.bmp
2000077,2,3,1,5020300,,3,1000208,宝鏡寺の熊谷と月光と村娘,ほうきょうじのくまがいとがっこうとむらむすめ,,,宝鏡寺の庭の北端にある肥後椿の原木となった熊谷が有名である。地上部で幹間130cm、さらに３幹に分岐しており、一重大輪の真紅の花は、蕾の円形態から特徴が見えるが、何よりも雄ずいが放射状に平開して発達する形状が、肥後椿のいわば原形ともなっている。葉も濃緑色で厚い。また、庭内の西北隅にある月光は、京椿の中でも貴重な名品で、とりわけここ宝鏡寺の個体は、弁化した雄ずいが鮮明な白色を呈することから、紅色花弁との対比が清らかに現れる特色がある。中庭には村娘の原木が濃桃色の八重の花をつける。,,,,2,京都市上京区寺之内通堀川東入百々町547,,,不可,1000,,1600,30,,"公開は人形展の時期のみ\n\n特別拝観日：3月1日～ 4月3日（3月1日のみ12時から）、11月1日～11月30日　※15:30受付終了",,"団体のみ要予約\n\n（電話、FAX）",sight/photo/mimon02A/A080.bmp
2000078,2,3,1,5020300,,3,1000210,宝泉院の五葉松,ほうせんいんのごようまつ,,,"宝泉院の庭内にあるマツ科のゴヨウマツ。ほぼ平面になる日本庭園の南部一帯を占める。樹高は11m、枝張りは南北11.5m、東西14mでほぼ扇形の樹冠をしている。樹形が極めて優れており、樹勢も旺盛で五葉松の大木として貴重。市指定天然記念物。\n\n\n\nホームページ　http://www.hosenin.net",,,,,大原勝林院町187,,,,,,,,,,,,sight/photo/mimon02A/A066.bmp
2000079,2,3,1,5020300,,3,1000212,法然院、北門の楓,ほうねんいんきたもんのかえで,,,法然院の北門内側の土堤にあるカエデ科のタカオカエデ。,,,,,鹿ケ谷,,,,,,,,,,,,
2000080,2,3,1,5020300,,3,1000212,法然院の楓,ほうねんいんのかえで,,,法然院境内、経蔵の西側斜面にあるカエデ科のタカオカエデ。,,,,,鹿ケ谷,,,,,,,,,,,,sight/photo/mimon02A/A012.bmp
2000081,2,3,1,5020300,,3,1000212,法然院の散椿,ほうねんいんのちりつばき,,,法然院、本堂北側の中庭にあるツバキ科のチリツバキ。建物の中庭でわずかな空間に生育するため、樹冠のほとんどは屋上に展開している。地蔵院椿寺の散椿とほぼ同年代に植えられたものであろう。「散りつばき　はくや　はりえを　はぐ如く……如是」の句がある。地蔵院（椿寺）の散椿と同じく、紅、桃、白、紅白、まだらと咲き分ける。,,,,,鹿ケ谷,,,,,,,,,,,,
2000082,2,3,1,5020300,,3,1000212,法然院の椋,ほうねんいんのむく,,,法然院境内、経蔵の西側にあるニレ科のムクノキ。経蔵西方の斜面上位にある。,,,,,鹿ケ谷,,,,,,,,,,,,sight/photo/mimon02A/A011.bmp
2000084,2,3,1,5020300,,3,1000225,妙蓮寺の妙蓮寺椿,みょうれんじのみょうれんじつばき,,,妙蓮寺にある椿。妙蓮寺は、永仁2年（1294年）、日像上人を開基として創建された本門法華宗の大本山である。枯山水の石庭は十六羅漢の石庭と呼ばれる。境内の椿を愛でて徳川家康が賛をよせたという妙蓮寺椿が有名。朱紅色一重の花をつけるので、紅妙蓮寺とも呼ばれている。この椿は早咲で11月から翌春の3月末まで咲き続け、茶花としても愛用される。,,,,,寺之内大宮東妙蓮寺前町875,,,不可,1000,,1600,30,"毎月12日及び水曜日\n\n12月26日～1月5日\n\n寺の行事その他で臨時休館有り","専属ガイドがご案内します。\n\n見学所要時間は最低30分",本山拝観料金の中に含まれているため単独での料金は不要,団体要予約（電話・ハガキ・FAX）,sight/photo/mimon02A/A076.bmp
2000085,2,3,1,5020300,,3,1000228,由岐神社の大杉,ゆきじんじゃのおおすぎ,,,由岐神社本殿石段の東側にあるスギ科のスギ。東側に鞍馬寺への参道がある。神社氏子衆では大杉さんの名で神木化されている。由岐神社のスギ3本とカゴノキが市指定天然記念物となっている。樹齢約800年、樹高53メートル。一心に願えば願い事が叶うとされる。,,,,,鞍馬本町,,,,,,,,,,,,sight/photo/mimon02A/A062.bmp
2000086,2,3,1,5020300,,3,1000240,霊鑑寺の紅梅,れいかんじのこうばい,,,霊鑑寺境内、門内正面西側にあるバラ科のウメ（八重咲紅色）。前庭の平地にある。いい伝えによると本寺の創立のころ、すなわち後水尾天皇の時代に植えられたものという。なお、当寺には京の名椿といわれる白牡丹、奴、舞鶴、衣笠、白玉などの品種がある。,,,,,鹿ケ谷御所の段町,,,不可,1000,,1600,30,"春の特別公開\n\nH27　3月28日～4月12日",,600円,無し,
2000087,2,3,1,5020300,,3,1000240,霊鑑寺の日光椿,れいかんじのじっこうつばき,,,霊鑑寺境内の庭園の南西隅にあるツバキ科のツバキ（日光）。「日光」は雄しべが小さな花弁状になって円形にまとまる「カラ」咲きの園芸品種のツバキ。後水尾天皇（1596～1680）の皇女の門跡尼寺であることから、おそらくこの時代の植栽にかかるものと伝えられている。市指定天然記念物。,,,,,鹿ケ谷御所の段町,,,不可,1000,,1600,30,"春の特別公開\n\nH27　3月28日～4月12日",,"600円\n\n",無し,sight/photo/mimon02A/A015.bmp
2000088,2,3,1,5020300,11,3,,北野天満宮　影向松,きたのてんまんぐう　ようごうまつ,,,"一の鳥居近くにある。菅公（菅原道真）が初雪の日に降臨され雪見の歌を詠まれるという伝説があり、初雪の日には祭事を行う。\n\n■交通案内\n\n　○京福北野線 北野白梅町駅　徒歩約10分\n\n　□市バス最寄バス停　北野天満宮前　徒歩1分\n\n　＜系統＞\n\n　◇京都駅前から 50、101\n\n　◇四条河原町から 10、203\n\n■駐車場\n\n　大型バス50台　無料\n\n　乗用車300台　無料（9:00～17:00）\n\n　但し、毎月25日は閉鎖。",,,602-83,,上京区御前通今小路上る馬喰町,075-461-0005,075-461-6556,参道の階段にスロープ有り。楼門脇に身障者用トイレ有り。,500,1800,1800,30,,10月～３月は5：30～17：30,無料,,sight/photo/mimon02s/s001.bmp
2000091,2,3,1,5020300,24,3,2091,黒田百年桜,くろだひゃくねんさくら,,,"常照皇寺から東に、国道477号を行くと下黒田、宮、上黒田を通り、左京区花背へと出ます。いずれも大堰川（上桂川）上流域の狭い谷あいに開けた集落です。宮地区は、近世以前は黒田宮村と称していました。黒田卿の氏神である春日神社の脇にかつて桜の大木がありましたが、明治6年の台風により倒れ、これを惜しんだ村びとが、一本の八重桜を跡に植えました。通常の桜と思い何気なく植えたものの、これが一重と八重の混じり咲く珍しい種とわかり、昭和42年「百年桜」と命名されて大切にされています。当時、樹齢およそ100年であることと、明治百年にあたることによる名前です。\n\n典型的なヤマザクラの変種。花は紅色大輪で、手毬のように固まり咲く。一重・八重・旗弁のあるものが混じる。八重一重といわれる類です。",,,,,,,,,,,,,,,,,sight/photo/mimon02s/s004.bmp
2000092,2,3,1,5020300,24,3,2092,片波の伏条台杉,ふくじょうだいすぎ,,,"～悠久の時を越えてそびえ立つ巨大伏条台杉～ \n\n片波川原流域一帯は、古くから御杣御料として守られてきた森で、今日まで人為的影響を受けながらも大切に守られてきた西日本屈指の巨大杉群落の森です。長岡京、平安京の造営時や御所炎上の際には、膨大な量の建築用材がこの地より供給されたという記録が残り、鎌倉、南北朝時代には、御料林を中心に林業技術が発達し、1本の木から多くの材がとれるように台杉（やぐら杉ともいう）仕立てが盛んに行われました。その後、山国スギと名づけられ品種改良も進み、台杉に代わり1本植えが中心になりました。明治時代に入り、御料地の解体（1869）に伴い民間に払い下げられ、片波の森も地域の人々に利用されていきますが、南北朝時代から放置された台杉仕立ての杉は、大きくなり過ぎたことが用材としての価値を下げ、伐採の手から逃れたと言われています。この貴重な伏条台杉群は、平成11年に京都府天然記念物に指定されました。また、自然度の高い貴重な植生を残すこの地域一帯は、京都府自然環境保全地域の第1号に指定され、大切に守られています。\n\n",,,,,,,,,,,,,,,,"入山に際しては、京北自然観察インストラクター連絡会（代表伊藤様）にお尋ねください。\n\n075-854-0937",sight/photo/mimon02s/s005.bmp
3000001,2,5,1,5020500,,3,,いけばな,いけばな,,,古くから伝わる日本独特の挿花の方法。その流派。生け花・花道・華道。源流は天平年間（729-49）に遡り、平安・鎌倉時代を経て京都で流儀・流派が室町期から江戸中期に成立。いけばな資料館（中京区六角通烏丸東入・池坊3階）がある。,,,,,,,,,,,,,,,,,
3000003,2,5,1,5020500,,3,,大原女,おはらめ,,,平家滅亡の後、大原に隠棲された建礼門院に仕えた阿波の内侍（あわのないじ）の、山野へ出る作業着姿が今に伝わったという。御所ぞめの帯に絹ふさの腰ひも、紺の木綿に白はばきをつけ、柴を頭上にささげた風雅な姿は、世に知られている。昨今、この里でも見ることは少なくなったが、地元の大原観光保勝会が風俗保存に力を入れ、「大原女まつり」で衣裳貸出しを企画、若い女性に人気を博す。,,,,,,,,,,,,,,,,,
3000004,2,5,1,5020500,,3,,雅楽,ががく,,,インド・中国・朝鮮半島から渡来、日本の古楽と合わせ伝統保存される正式な宮廷舞楽。701年（大宝1）宮中に雅楽寮を設け宮廷・社寺の式楽に。中世に一時衰退したが江戸期に朝廷・幕府が再興。京都に現在、平安雅楽会・京都古楽保存会がある。,,,,,,,,,,,,,,,,,
3000005,2,5,1,5020500,,3,,歌舞伎発祥の地,かぶきはっしょうのち,,,鴨川の四条河原。1603年（慶長8）出雲の阿国が歌舞伎踊りを演じたところ。これが歌舞伎の始まりで、江戸前期には常設やぐら=芝居小屋が7軒あり栄えた。現在、南座だけが残っており、毎年「吉例顔見世興行」がある。1991年（平成3）大改修した。南座西側に石碑。京阪電車祇園四条、市バス四条京阪前すぐ。,,,,,,,,,,,,,,,,,
3000008,2,5,1,5020500,,3,,祇園囃子,ぎおんばやし,,,祇園祭の際、各山鉾が演奏する音楽。鉦、横笛、太鼓から成る。一般に「コンチキチン」で知られる。室町末期、能楽をヒントに出来たといわれ、現在のようなはやしになったのは江戸時代に入ってから。メンバーは交代要員を含めて約40人が乗り込む。曲目は各山鉾によって異なり、前半と後半によっても異なる。,,,,,,,,,,,,,,,,,
3000009,2,5,1,5020500,,3,,狂言,きょうげん,,,もとは能会で、能と能の間に演じられた芸能で、笑いの要素が洗練された鎌倉・室町時代のせりふ劇。例外として京都の壬生狂言などの無言劇もある。江戸初期に大蔵流・鷺流・和泉流が確立。明治期に衰退し、京都の大蔵流茂山千五郎・忠三郎両家のみとなったが、戦後2世千作が普及と大衆化につとめた。,,,,,,,,,,,,,,,,,
3000010,2,5,1,5020500,,3,,京舞,きょうまい,,,日本舞踊の一つ。京都で元禄年間（1688-1704）夷屋吉郎兵衛が琴を中心の御所風座敷舞を始めたのが起こり。京舞として現在まで残ったのは井上流だけ。京舞井上流は井上八千代（1767-1854・明和4～安政1）初世家元が創始。流儀は御所風で地唄舞を基礎とし、しかも能楽の影響を受けた高尚優美な舞を継承。春の都をどりは京舞によって行われる。家元名は代々井上八千代で当代は2000年（昭和22）5世襲名、,,,,,,,,,,,,,,,,,
3000011,2,5,1,5020500,,3,,蹴鞠,けまり,,,蹴鞠は日本の伝統的球技。7間半（12.7メートル）四方の鞠庭（コート）で、8人の競技者が鹿の皮で作った球を落さぬよう蹴りあう古式豊かな行事。御所の伝統芸能として伝えられ、現在、京都蹴鞠保存会により継承されている。無形文化財指定。烏帽子に水干、蹴鞠用の革靴という華やかな装束で蹴りあう光景は、見る人を平安情緒に誘い込む。,,,,,,,,,,,,,,,,,
3000013,2,5,1,5020500,,3,,茶道,さどう,,,安土桃山時代、千利休（1522-91・大永2～天正19）が京で初めて茶の道を確立した。現在市内には、利休の流れをくむ表千家（不審菴）、裏千家（今日庵）、武者小路千家（官休庵）の三千家が上京区にあるのをはじめ、10指に余る茶道の家元がある。京都は全国屈指のお茶の盛んな都市。,,,,,,,,,,,,,,,,,
4000014,3,4,1,5030400,,3,,祇王寺日記,ぎおうじにっき,,,高岡智照尼の日記。昭和48年発表。朝寝坊は50年来の習性。毎朝のおつとめはごめん蒙っている……。何かにつけて型破りな庵主の風流三昧の自由な日々を綴った日記である。,,,,,,,,,,,,,,,,,
3000014,2,5,1,5020500,,3,,島原の太夫,しまばらのたゆう,,,島原は1589年（天正17）秀吉によるわが国最初の公許遊廓で、当時京都随一の賑わいであった。この廓の数多い遊女の最高位にあったのが太夫。容姿に優れるばかりか、茶、花、歌、舞、文学など、あらゆる教養を身につけたといわれ、寛永年間（1624-44）の名妓「吉野太夫」の名が高い。廓としての島原は既にないが、太夫の風俗は伝承されていて、重さ45キロにも及ぶ豪華な衣装の太夫道中が見物できる催しもある。,,,,,,,,,,,,,,,,,
3000016,2,5,1,5020500,,3,,念仏狂言,ねんぶつきょうげん,,,京都でいう念仏狂言は、大念仏あるいは大念仏狂言といわれ、仏教の教化活動のため宗教劇に仕立てられたのが始まりで、その後、しだいに能、狂言などが取り入れられ芸能化が進むようになった。現在、壬生寺の壬生大念仏狂言、嵯峨清凉寺の嵯峨大念仏狂言、千本閻魔堂の千本えんま堂狂言、神泉苑の神泉苑大念仏狂言が行われている。,,,,,,,,,,,,,,,,,
3000017,2,5,1,5020500,,3,,能,のう,,,日本古典芸能の一つ。平安時代以来の猿楽から鎌倉時代に歌舞劇が生まれ、能と呼ばれる。能楽は能と狂言の総称で、現在は観世・宝生・金春・金剛・喜多の5流がある。金剛流は京都に家元がある唯一の流派。金剛巌が1937年（昭和12）家元を相続。現在は、金剛永謹が第二十六世宗家を継承している。,,,,,,,,,,,,,,,,,
3000018,2,5,1,5020500,,3,,舞妓,まいこ,,,可憐な容姿で国内外に知られている。京都らしさの代表風俗。幼い頃から厳しい芸事の稽古を受けて一人前になる。京友禅の着物に西陣織のだらりの帯、目にもあやな容姿が、古都をあざやかに印象づける。花街の接客が本業であるが、最近は海外への親善使節としての役割も大きい。,,,,,,,,,,,,,,,,,
