6000035,8,1,1,5080100,5,3,6035,清滝,きよたき,,,右京区・愛宕山東南ふもとの地域の名。愛宕神社への参詣路で、戦前はケーブルもあった。夏は京都で数少ない納涼避暑地となる。俳聖・松尾芭蕉が句を詠み、徳富蘆花が失恋の傷みをいやし、与謝野寛・晶子夫妻が逗留するなどロマンの地である。京都バス清滝一帯。,,,,,,,,,,,,,,,,,sight/photo/mimon06A/A035.bmp
6000036,8,1,1,5080100,4,3,6036,雲ケ畑,くもがはた,,,北区上賀茂から北へ12～13キロ、鴨川の源流・雲ケ畑川を挟んだ山間に広がる地域の名。古来から林業が盛ん。平安時代から大内裏修理職領、江戸時代には仙洞御所領となり皇室との関係が深い。地名の起源に諸説。1949年（昭和24）京都市に編入。京都バス岩屋橋一帯。,,,,,,,,,,,,,,,,,sight/photo/mimon06A/A036.bmp
6000037,8,1,1,5080100,4,3,6037,鞍馬口,くらまぐち,,,北区鞍馬口町として名が現在残る京の七口の一つ。鴨川の出雲路橋西の鞍馬口通付近を称し、出雲口とも。京都から鞍馬街道（丹波街道）の入口にあたりこの名がある。南北朝期から、ここに関を設け通過する荘園年貢・商品・通行人から関銭を徴収した。,,,,,,,,,,,,,,,,,sight/photo/mimon06A/A037.bmp
6000038,8,1,1,5080100,20,3,6038,栗栖野,くるすの,,,「くりすの」とも読む。山科区南西部の山科川と旧安祥寺川に挟まれた丘陵地一帯の地名。1931年（昭和6）京都市に編入。今は新興住宅街となり人家が密集。一帯の発掘調査で縄文後期以後の古代遺跡が判明。なお北区鷹峯方面にも同じ名をとどめる所がある。市バス勧修校前一帯。,,,,,,,,,,,,,,,,,sight/photo/mimon06A/A038.bmp
6000039,8,1,1,5080100,8,3,6039,蹴上,けあげ,,,東山区の北東部、京都市蹴上浄水場付近一帯の地名。牛若丸の奥州くだりにまつわる騒動が地名の起こりと伝える。昔は京都の東玄関口で、多くの茶店が軒を連ねていた。1890年（明治23）疏水の工事が完成してから、急速に発展した。わが国最初の発電所がある。,,,,,,,,,,,,,,,,,
6000040,8,1,1,5080100,4,3,6040,玄琢,げんたく,,,北区鷹峯の東方にある地名。江戸初期、御典医・野間玄琢が居を構えていたのが地名の始まり。玄琢は徳川2代将軍秀忠や後水尾天皇の中宮・和子の侍医を勤めた名医。鷹峯の常照寺に近い竹林の中に墓が残っている。現在は静かな住宅街。市バス玄琢一帯。,,,,,,,,,,,,,,,,,sight/photo/mimon06A/A040.bmp
6000041,8,1,1,5080100,12,3,6041,荒神口,こうじんぐち,,,鴨川の西岸、山中越で近江へ通じる道の京への出入口。京の七口の一つ。古くは吉田口・今道口。志賀道口とも。1600年（慶長5）に三宝荒神をまつる清荒神（護浄院）が高辻堀川から移され現地名になる。,,,,,,,,,,,,,,,,,sight/photo/mimon06A/A041.bmp
6000042,8,1,1,5080100,9,3,6042,五条坂,ごじょうざか,,,東山区五条通の大和大路から東大路、清水寺にかけてのなだらかな坂道。付近は伝統産業・清水焼の中心地で陶磁器の卸・小売店や陶工の家が多い。江戸時代には野々村仁清、清水六兵衛ら名工が多く出た。毎年8月には陶器祭が催される。市バス五条坂一帯。,,,,,,,,,,,,,,,,,sight/photo/mimon06B/B004.bmp
6000043,8,1,1,5080100,16,3,6043,西院,さいいん,,,「さい」とも読む。右京区南東部の広い商業、住宅地域の名。淳和天皇が譲位後ここに建てた後院・淳和院が別名西院だったこと、近くの高山寺が賽（さい）の河原といわれたことなどに由来する。1931年（昭和6）京都市に編入。阪急電車西院、京福電車西院一帯。,,,,,,,,,,,,,,,,,sight/photo/mimon06A/A042.bmp
6000044,8,1,1,5080100,17,3,6044,嵯峨鳥居本,さがとりいもと,,,右京区の西部、小倉山の北ふもとから清滝付近にかけての地域の名。愛宕山頂に近い愛宕神社への参詣道に当たり、その「一ノ鳥居」付近に集落が形成されたことから地名となった。1931年（昭和6）に京都市に編入されたが、1979年（同54）には地域の約50戸が、文化財保護法に基づく「重要伝統的建造物群保存地区」に指定されている。地域内に化野念仏寺がある。京都バス鳥居本一帯。,,,,,,,,,,,,,,,,,sight/photo/mimon06A/A043.bmp
6000045,8,1,1,5080100,17,3,6045,嵯峨野,さがの,,,右京区太秦の西、桂川の北付近に広がる広い住宅地域の名。優れた風物が好まれ、平安時代には天皇、大宮人たちの絶好の遊猟、行楽地だった。1931年（昭和6）京都市に編入。さらに1970年（昭和45）新丸太町通が開通してから急速に発展した。京福電車有栖川一帯。,,,,,,,,,,,,,,,,,sight/photo/mimon06A/A044.bmp
6000046,8,1,1,5080100,12,3,6046,猿ヶ辻,さるがつじ,,,京都御所の東北角付近のこと。御所の鬼門にあたるため、築地屋根下の蟇股（かえるまた）に日吉社の木彫りの猿があり、この名がついた。幕末に尊攘派の公家、姉小路公知がこのあたりで暗殺された事件があり、猿ヶ辻の変という。,,,,,,,,,,,,,,,,,sight/photo/mimon06A/A045.bmp
6000047,8,1,1,5080100,9,3,6047,三年坂,さんねんざか,,,産寧坂ともいう。八坂から清水寺に通じる道路のうち、急な石畳の坂道約100メートル。重要伝統的建造物群保存地区指定。古めかしい造りの土産物店が並ぶ京情緒あふれる地域。808年（大同3）清水寺創建の際に開かれたことから、その名があるという。市バス清水道300メートル。,,,,,,,,,,,,,,,,,sight/photo/mimon06A/A046.bmp
6000048,8,1,1,5080100,7,3,6048,鹿ケ谷,ししがたに,,,左京区東南、如意ケ嶽ふもと一帯の住宅地帯の名。平安前期の高僧・円珍が山中で道に迷い、鹿に助けられたことから名付けられた地名。古くから貴人の山荘や寺院が多かった。僧・俊寛が平家打倒の密議をこらしたのもここ。市バス上宮ノ前町一帯。,,,,,,,,,,,,,,,,,sight/photo/mimon06A/A047.bmp
6000049,8,1,1,5080100,13,3,6049,四条大宮,しじょうおおみや,,,中京区の四条通と大宮通の交差点付近。1963年（昭和38）に阪急電車京都線が河原町へ延長するまではここが終点だった。従って京の第2都心として繁栄した。今も映画館、飲食街、商店街がある有数の繁華街である。阪急電車大宮、京福電車四条大宮一帯。,,,,,,,,,,,,,,,,,sight/photo/mimon06A/A048.bmp
6000050,8,1,1,5080100,13,3,6050,四条河原町,しじょうかわらまち,,,京都最大の繁華街の中心。京都を観光して「河ブラ」をしない若者はいないといわれる。高島屋・マルイ・大丸各百貨店をはじめ、四条・河原町・寺町・新京極各商店街も密集、ファッション、味の発進地になっている。京阪電車祇園四条、阪急電車河原町、市バス四条河原町。,,,,,,,,,,,,,,,,,sight/photo/mimon06A/A049.bmp
6000051,8,1,1,5080100,1,3,6051,静原,しずはら,,,左京区静市静原町。京都市北部の鞍馬と大原の間にある山里の地名。平家物語には後白河法皇がここを通って大原へ御幸されたり、平治の乱に敗れた悪源太義平がこの地に隠棲したなどの記録が残っている。1949年（昭和24）京都市に編入。京都バス静原一帯。,,,,,,,,,,,,,,,,,sight/photo/mimon06A/A050.bmp
6000052,8,1,1,5080100,20,3,6052,四宮,しのみや,,,山科区北東部の地域の名。東は平坦地で大津市と接する。仁明天皇の第4皇子・人康親王が山荘を営んだのが地名の始まりといわれる。大和・山城と近江を結ぶ交通の要衝として古くから栄えた。京阪電車四ノ宮一帯。,,,,,,,,,,,,,,,,,sight/photo/mimon06A/A051.bmp
6000053,8,1,1,5080100,14,3,6053,島原,しまばら,,,下京区西新屋敷町。西本願寺の西にある花街の名。戦後お茶屋86軒を数えていたが今は数軒。角屋、輪違屋がかつての遺構で、文化財。市バス島原口300メートル。,,,,,,,,,,,,,,,,,sight/photo/mimon06A/A052.bmp
6000054,8,1,1,5080100,9,3,6054,下河原,しもがわら,,,東山区の高台寺から西の地域の名。現在は高級料亭などが多い。上流からの二つの小川が合流し、土砂が堆積する河原地だったのが地名の起こり。なお南禅寺の北にも南禅寺下河原の地名がある。市バス東山安井東一帯。,,,,,,,,,,,,,,,,,sight/photo/mimon06A/A053.bmp
6000055,8,1,1,5080100,7,3,6055,修学院,しゅうがくいん,,,左京区の北東部。比叡山の南西ふもと一帯に広がる地域の名。「しゅがくいん」とも呼ぶ。比叡山三千坊の一つ修学院があったことからこの名がついた。1925年（大正14）叡山平坦線が開通してから急速に開け、1931年（昭和6）に京都市に編入。地域内に修学院離宮などがある。,,,,,,,,,,,,,,,,,sight/photo/mimon06A/A054.bmp
6000056,8,1,1,5080100,12,3,6056,聚楽廻,じゅらくまわり,,,中京区聚楽廻の地域、千本丸太町の南西一帯の地名。豊臣秀吉が1587年（天正15）、大内裏旧跡に築いた城郭「聚楽第」の南西部にあり、当時から聚楽廻とも呼ばれていた。江戸時代にはこの辺りに京都所司代与力や同心の屋敷があった。市バス千本丸太町・南西一帯。,,,,,,,,,,,,,,,,,sight/photo/mimon06A/A055.bmp
6000057,8,1,1,5080100,12,3,6057,白川口,しらかわぐち,,,上京区の鴨川に架かる荒神橋付近をさす。京の七口の一つ。今道の下口とも。洛中から荒神口を経て山中越で近江方面、若狭と結ぶ。山中越は重要な間道で、白川口はその出入口にあたる。,,,,,,,,,,,,,,,,,sight/photo/mimon06A/A056.bmp
6000058,8,1,1,5080100,5,3,6058,杉坂,すぎさか,,,北区杉坂。都心から北北西へ約20キロの山間の村落の名。平安の三蹟といわれる小野道風を祭る道風神社がある。隣接の中川、小野郷と同様、古くから木材の産地で、江戸時代には仙洞御料（幕府が上皇に一代限り献上する領地）だった。1948年（昭和23）京都市に編入。JRバス杉坂一帯。,,,,,,,,,,,,,,,,,sight/photo/mimon06A/A057.bmp
6000059,8,1,1,5080100,10,3,6059,滑石越,すべりいしごえ,,,東山区・山科区を結ぶ東山を越える道。全長3.5キロ。東山区の東大路通今熊野から東南に向かい山科区の旧西野山村を経て勧修寺に至る旧醍醐街道。今熊野付近の登り口は瓦坂とも。渋谷越より一つ南の京の東入口にあたる。,,,,,,,,,,,,,,,,,sight/photo/mimon06A/A058.bmp
6000060,8,1,1,5080100,22,3,6060,墨染,すみぞめ,,,伏見区中部の大和街道（府道六地蔵・下鳥羽線）～師団街道間の地域名。平安前期の歌人上野みね雄の「古今集」の歌に「…墨染に咲け」とあったのが地名の起こり。元禄期に墨染遊廓が設けられたが、1911年（明治44）、京阪電鉄開通で墨染駅前商店街と名を変えた。京阪電車墨染一帯。,,,,,,,,,,,,,,,,,sight/photo/mimon06A/A059.bmp
6000061,8,1,1,5080100,4,3,6061,清蔵口,せいぞうぐち,,,上京区新町通と鞍馬口通の交差点付近をさす。京の七口の一つ。西蔵口・新町頭とも。清蔵口の設置は中世にさかのぼるともいうが確認できない。長坂口の起点とされ洛中と丹波を結ぶ交通の要所。現在、北区に上清蔵口町、上京区に下清蔵口町がある。,,,,,,,,,,,,,,,,,sight/photo/mimon06A/A060.bmp
6000062,8,1,1,5080100,11,3,6062,大将軍,たいしょうぐん,,,北区の最南端、西大路一条から南一帯の市街地の名。近くの上京区にある大将軍八神社が地名の起こり。大将軍とは陰陽道にいう西方の神の意。古くは典型的な近郊農村だった。1918年（大正7）京都市に編入後、急速に都市化した。市バス大将軍一帯。,,,,,,,,,,,,,,,,,sight/photo/mimon06A/A061.bmp
6000063,8,1,1,5080100,5,3,6063,高雄,たかお,,,右京区梅ケ畑。都心から15キロ。高雄山（428メートル）のふもと、清滝川に沿った一帯の地名。高尾とも書き、付近の栂尾、槙尾とも合わせて「三尾」といわれる。京都屈指の紅葉の名所。南北朝時代から紅葉どころとして詩歌や絵画にしばしば登場。市バス高雄一帯。,,,,,,,,,,,,,,,,,sight/photo/mimon06A/A062.bmp
6000064,8,1,1,5080100,3,3,6064,宝ヶ池,たからがいけ,,,左京区松ケ崎の池・宝ケ池を中心とした地名。池は1763年（宝暦13）かんがい用水として作られた。周囲1.8キロ。1931年（昭和6）京都市に編入。戦後1949年（昭和24）付近43万平方メートルを宝ケ池公園として整備した。市バス宝ケ池公園前200メートル。,,,,,,,,,,,,,,,,,sight/photo/mimon06A/A063.bmp
6000065,8,1,1,5080100,7,3,6065,田中,たなか,,,左京区の西部、高野川下流の川東一帯の地域の名。周囲を吉田、北白川、一乗寺、高野各地域と接する。中世の記録にすでに「田中」の地名が出てくる。地域の南東に知恩寺、京都大学がある。,,,,,,,,,,,,,,,,,sight/photo/mimon06A/A064.bmp
6000066,8,1,1,5080100,14,3,6066,丹波口,たんばぐち,,,京都市街から西の桂川を渡り老ノ坂を越える丹波地方への起点。中世には七条大路の西端に街道が続いていたため、大宮大路との交差点西に「西七条口」という関所があり、この付近が丹波口といわれる。御土居の洛外への西南出入口にあたり交通の要衝。現在、JR山陰線「丹波口」駅がある。七口の一つ。,,,,,,,,,,,,,,,,,sight/photo/mimon06A/A065.bmp
6000067,8,1,1,5080100,23,3,6067,丹波橋,たんばばし,,,伏見区桃山筒井伊賀西町。近鉄・京阪両電鉄が同じ駅名で隣接し、相互に乗り換え可能という市内屈指の交通の要衝。伏見城の外堀に長さ15メートルの橋が架かり、その東側に桑山丹波守の屋敷があったのが地名になった。1931年（昭和6）京都市に編入。,,,,,,,,,,,,,,,,,sight/photo/mimon06A/A066.bmp
6000068,8,1,1,5080100,23,3,6068,中書島,ちゅうしょじま,,,伏見区南端の町の名で正しくは柳町。文禄年間（1592―96）、脇坂中務大輔がここに屋敷を構えたが、中務のことを「中書さん」と呼んだのが地名の起こり。1699年（元禄12）、時の伏見奉行が遊女を集めて遊廓とした。以後、淀川を往来する旅客らで大いに栄えた。京阪電車中書島一帯。,,,,,,,,,,,,,,,,,sight/photo/mimon06A/A067.bmp
6000069,8,1,1,5080100,12,3,6069,出町,でまち,,,上京区河原町今出川の北部一帯の商業地区の地名。今出川の一筋北が出町橋に通じるため、通り名をいう場合もある。市内から洛北への出はずれ、の意味から「出町」になった。古くから洛北の農家と取り引きする商家が多かった。この地域だけの短い道、桝形通がある。市バス河原町今出川一帯。,,,,,,,,,,,,,,,,,sight/photo/mimon06A/A068.bmp
6000070,8,1,1,5080100,14,3,6070,東寺口,とうじぐち,,,西国街道（国道171号）から京都市中に入る入口。南区唐橋大宮尻町付近をいう。中世には京都の政権争いでたびたび戦略地点となる。近世になっても七口の一つとして要衝に変わりなく、河内・摂津・播磨への起点であった。,,,,,,,,,,,,,,,,,sight/photo/mimon06A/A069.bmp
6000071,8,1,1,5080100,5,3,6071,栂尾,とがのお,,,右京区梅ケ畑にある地名。清滝川沿いにあり隣接の高雄（尾）、槙尾とともに三尾（さんび）と呼ばれる。紅葉の名所。13世紀に再興された栂尾山高山寺が地名になったといわれる。日本最初の茶園（鎌倉前期）として知られ、今も高山寺境内に面影を残す。JRバス栂ノ尾一帯。,,,,,,,,,,,,,,,,,sight/photo/mimon06A/A070.bmp
6000072,8,1,1,5080100,16,3,6072,常盤,ときわ,,,右京区・双岡の西方にある住宅地域の名。嵯峨天皇の子・源常（みなもとのときわ）の山荘があったのが地名になった。その後も多くの山荘や寺院が建ち寺侍が住んで村となった。歌枕としても知られる。1931年（昭和6）京都市に編入。市バス常盤仲之町一帯。,,,,,,,,,,,,,,,,,sight/photo/mimon06A/A071.bmp
6000073,8,1,1,5080100,10,3,6073,鳥辺野,とりべの,,,東山区南部、阿弥陀ケ峰北麓の五条坂から南麓の今熊野にいたる丘陵地、鳥辺山のふもと一帯を総称。平安期から墓地、葬送の地として知られる。現在は東山区清水寺の南西、大谷本廟東方の山腹にある墓地を指す。広さは、約4万平方メートルにもおよぶ。市バス池田町一帯。,,,,,,,,,,,,,,,,,sight/photo/mimon06A/A072.bmp
6000074,8,1,1,5080100,5,3,6074,中川,なかがわ,,,北区の北部。都心から20キロ、周山街道（国道162号）沿いの山間の集落。北は小野郷、南は高雄と接する。北山杉磨き丸太の主産地。集落の中を清滝川が流れているのが地名になった。古くから林業が盛んで、特に大阪の林木商との取引が多かった。1948年（昭和23）京都市に編入。JRバス中川一帯。,,,,,,,,,,,,,,,,,sight/photo/mimon06A/A073.bmp
6000075,8,1,1,5080100,4,3,6075,長坂口,ながさかぐち,,,北区鷹峯から長坂を経て杉坂に至る丹波街道の登り口付近をいう。京の七口の一つ。古くからこの地にしばしば関所が設けられ、長坂口は近世になっても重要視された。,,,,,,,,,,,,,,,,,sight/photo/mimon06A/A074.bmp
6000076,8,1,1,5080100,20,3,6076,椥辻,なぎのつじ,,,山科区・山科盆地のほぼ中央に位置する商業・住宅地域の名。地区内を南北に外環状線、東西に国道1号線が走る。中世には南木辻（なぎつじ）と書き、水利の豊かな農村地帯だった。1931年（昭和6）京都市に編入。以後急速に都会化した。市バス椥辻一帯。,,,,,,,,,,,,,,,,,sight/photo/mimon06A/A075.bmp
6000077,8,1,1,5080100,5,3,6077,鳴滝,なるたき,,,右京区の北部、御室の西にある近郊住宅地の名。地域を流れる御室川の渓流がこのあたりで滝のようになり、水音が遠くまで鳴り響いたので地名となった。天然の鳴滝砥石の産地として全国的に有名。1931年（昭和6）京都市に編入。市バス鳴滝本町西一帯。,,,,,,,,,,,,,,,,,sight/photo/mimon06A/A076.bmp
6000078,8,1,1,5080100,18,3,6078,西京極,にしきょうごく,,,右京区南端。西京極総合運動公園に象徴される付近一帯の地域の名。1931年（昭和6）京都市に編入の際、平安京の西の京極に位置するところから西京極と名付けた。戦後、かど野中通や五条通など道路が整備され飛躍的に発展した。阪急電車西京極一帯。,,,,,,,,,,,,,,,,,sight/photo/mimon06A/A077.bmp
6000079,8,1,1,5080100,11,3,6079,西陣,にしじん,,,市街地の北東部。北区と上京区にまたがる広い地域の名。応仁の乱（1467-77）で、東軍の細川勝元に対して、西軍の山名宗全が堀川上立売付近に本陣を築いたことから地名となった。乱後、機業家集団「大舎人座」がここに住みつき織物の技術を競った。今も地域内では機織りの音が絶えず、ここで織られる伝統工芸品・西陣織は国際的に有名。,,,,,,,,,,,,,,,,,sight/photo/mimon06A/A078.bmp
6000080,8,1,1,5080100,16,3,6080,花園,はなぞの,,,右京区東部の一地域の名。北は一条通、南は丸太町通が通り、西は双岡に接する。花園天皇（1297-1348）が1335年（建武2）、出家してここに行宮を造営（のち妙心寺）したことから地名になったという。1931年（昭和6）京都市に編入。地域内に妙心寺をはじめ法金剛院やJR嵯峨野線（山陰本線）花園駅がある。,,,,,,,,,,,,,,,,,sight/photo/mimon06A/A079.bmp
6000081,8,1,1,5080100,4,3,6081,原谷,はらだに,,,北区大北山原谷乾町。都心から北西10キロの山中にある地名。交通が不便なうえ水不足で、長年荒野のままだったが、1948年（昭和23）、満州（現中国東北部）からの引揚者のうち京都出身者が入植、開拓した。現在は酪農に加えて西陣の機業も進出、住宅地としても開けている。市バス原谷一帯。,,,,,,,,,,,,,,,,,sight/photo/mimon06A/A080.bmp
6000082,8,1,1,5080100,4,3,6082,氷室,ひむろ,,,鷹峯から北へ約6キロ。山間集落の地名になっているが、もとより氷室は古代の氷の生産、貯蔵地。平安遷都により京都の周辺に6カ所の氷室が設けられ、ここはそのうちの一つで現在確認できる唯一の場所。氷室跡は現在3カ所残り、約20平方メートルの窪地になっている。氷を造った池は5カ所あり、今は灌漑用水池になっている。また氷室、氷池の守護神氷室神社が祭られている。,,,,,,,,,,,,,,,,,sight/photo/mimon06A/A081.bmp
6000083,8,1,1,5080100,7,3,6083,百万遍,ひゃくまんべん,,,左京区田中の一部。東大路今出川交差点付近一帯の通称でにぎやかな学生街。1331年（元弘1）、各地で疫病が流行の際、近くにある知恩寺の8世・空円が百万回の唱名をして鎮めたため、後醍醐天皇から「百万遍」の号を賜わったのが起こり。市バス百万辺一帯。,,,,,,,,,,,,,,,,,sight/photo/mimon06A/A082.bmp
6000084,8,1,1,5080100,22,3,6084,深草,ふかくさ,,,伏見区の北部、稲荷山の西南ふもとに広がる地域の名。多くの古墳が発掘されるなど古代から開けていた。小野小町の恋人、深草少将ゆかりの地でもある。近郷農村地帯だったが、1907年（明治40）陸軍第16師団が置かれてから活気づいた。JR稲荷、京阪電車深草一帯。,,,,,,,,,,,,,,,,,sight/photo/mimon06A/A083.bmp
6000085,8,1,1,5080100,16,3,6085,福王子,ふくおうじ,,,右京区宇多野福王子町。仁和寺の西、福王子神社を中心とした住宅地域の名。1872年（明治5）の統計では戸数38と小さな村だった。1931年（昭和6）京都市に編入。市バス福王子一帯。,,,,,,,,,,,,,,,,,sight/photo/mimon06A/A084.bmp
6000086,8,1,1,5080100,22,3,6086,藤森,ふじのもり,,,伏見区中部、深草地域のうち藤森神社を中心とした地名。江戸時代から紀伊郡深草村の一部だった。旧陸軍第16師団司令部の跡地が1948年（昭和23）京都学芸大学（現教育大）に。京阪電車藤森、市バス藤森神社前一帯。,,,,,,,,,,,,,,,,,sight/photo/mimon06A/A085.bmp
6000087,8,1,1,5080100,23,3,6087,伏見,ふしみ,,,伏見区の中南部。桃山丘陵とその西ふもと一帯に広がる地域の名。日本書紀にも見えるが、延久年間（1069-74）に橘俊綱がこの地に山荘を造営して伏見殿と称したのが地名になったとも伝わる。良質の水がわくことから古くは「伏水」とも書いた。豊臣秀吉の伏見城築城後、長く政治、経済の中枢地となった。1929年（昭和4）伏見町を母体に市制を施行、2年後に京都市と合併した。,,,,,,,,,,,,,,,,,sight/photo/mimon06A/A086.bmp
6000088,8,1,1,5080100,13,3,6088,先斗町,ぽんとちょう,,,中京区の木屋町と鴨川の中間、四条通以北の先斗町通一帯の地名。お茶屋が軒を連ねる花街。先斗町通の北端に先斗町歌舞練場があり、春秋2回鴨川をどりが公演され人気の的。この辺りは1670年（寛文10）鴨川の護岸工事で出現した土地。河原町にのぞむ先端の地（ポルトガル語でポント）からこの名があるとか。市バス四条河原町200メートル。,,,,,,,,,,,,,,,,,sight/photo/mimon06A/A087.bmp
6000089,8,1,1,5080100,5,3,6089,槙尾,まきのお,,,右京区梅ケ畑にある地名。清滝川沿いにあり、隣接の高雄（尾）、栂尾とともに三尾（さんび）と呼ばれる。京都有数の紅葉の名所。高山寺との境界を定めた1230年（寛喜2）の文書にすでに「西限槙尾谷押河谷北…」とあり、この地名は古くからあった。JRバス槙ノ尾一帯。,,,,,,,,,,,,,,,,,sight/photo/mimon06A/A088.bmp
6000090,8,1,1,5080100,6,3,6090,松ヶ崎,まつがさき,,,左京区西部の地域で、北は岩倉、南は下鴨に接する地名。丘陵地帯が、北山の出崎で松の木が生い茂っていたことから地名が生まれた。松ヶ崎の東山、西山に、京都五山送り火（8月16日）の「妙」と「法」が点火される。1931年（昭和6）京都市に編入。,,,,,,,,,,,,,,,,,sight/photo/mimon06A/A090.bmp
